{"artifacts":[{"artifact_id":"artifact-5812af58b8c7fcda8129803e00b509c79c011f554a3bdabb4681948053ba85d8","content_ref":"/v1/artifacts/artifact-5812af58b8c7fcda8129803e00b509c79c011f554a3bdabb4681948053ba85d8","lineage":[],"mime_type":"text/html","observation_id":"observation-11111111111111111111111111111111","observed_at":"2026-08-25T12:00:00Z","role":"source","sha256":"aaaaaaaaaaaaaaaaaaaaaaaaaaaaaaaaaaaaaaaaaaaaaaaaaaaaaaaaaaaaaaaa","size_bytes":62,"source_url":"https://www.soa.org/research/annual/","tool_id":"web_http","tool_version":"1.0.0"}],"attempts":[{"attempt_id":"attempt-completed-0","bytes_received":62,"error":null,"final_url":"https://www.soa.org/research/annual/","finished_at":"2026-08-25T12:00:00Z","http_status":200,"order":0,"outcome":"succeeded","requested_url":"https://www.soa.org/research/annual","requests":2,"runtime_ms":120,"schema_version":"web-listening-attempt.v1","started_at":"2026-08-25T11:59:59Z","tool_id":"web_http","tool_version":"1.0.0"}],"errors":[],"generated_at":"2026-08-25T12:00:01Z","handoff_id":"b3aad4174f71100edf78f6f7fea03a5a86ae0b2f577514ce0e5da47b1911d446","job_id":"run-completed-001","producer":{"name":"web_listening_new","version":"acquisition-handoff-producer.v1"},"run_id":"run-completed-001","schema_version":"acquisition-handoff.v1","source":{"current_url":"https://www.soa.org/research/annual/","final_url":"https://www.soa.org/research/annual/","redirects":[{"decision":"followed","from_url":"https://www.soa.org/research/annual","http_status":301,"order":0,"to_url":"https://www.soa.org/research/annual/"}],"requested_url":"https://www.soa.org/research/annual","source_id":"https://www.soa.org/research/annual"},"status":"completed","usage":{"bytes_received":62,"requests":2,"runtime_ms":130,"tool_attempts":1}}
