{"artifacts":[{"artifact_id":"artifact-8dd5fba1f6574d3ed187713e69492b0d61ad4efba88b23687963323bae8bf6df","content_ref":"/v1/artifacts/artifact-8dd5fba1f6574d3ed187713e69492b0d61ad4efba88b23687963323bae8bf6df","lineage":[],"mime_type":"text/html","observation_id":"observation-cccccccccccccccccccccccccccccccc","observed_at":"2026-08-25T15:00:02Z","role":"source","sha256":"dddddddddddddddddddddddddddddddddddddddddddddddddddddddddddddddd","size_bytes":30,"source_url":"https://www.casact.org/reports/","tool_id":"web_http","tool_version":"1.0.0"}],"attempts":[{"attempt_id":"attempt-partial-0","bytes_received":30,"error":null,"final_url":"https://www.casact.org/reports/","finished_at":"2026-08-25T15:00:02Z","http_status":200,"order":0,"outcome":"succeeded","requested_url":"https://www.casact.org/reports","requests":1,"runtime_ms":60,"schema_version":"web-listening-attempt.v1","started_at":"2026-08-25T15:00:01Z","tool_id":"web_http","tool_version":"1.0.0"}],"errors":[{"code":"coverage.partial","details":{"reason":"budget"},"message":"Coverage was partial"}],"generated_at":"2026-08-25T15:00:04Z","handoff_id":"41a50dc78d0639eacc606e302bd3c67720bd75842bd438895dbb2911ea2c1816","job_id":"run-partial-001","producer":{"name":"web_listening_new","version":"acquisition-handoff-producer.v1"},"run_id":"run-partial-001","schema_version":"acquisition-handoff.v1","source":{"current_url":"https://www.casact.org/reports/","final_url":"https://www.casact.org/reports/","redirects":[{"decision":"followed","from_url":"https://www.casact.org/reports","http_status":301,"order":0,"to_url":"https://www.casact.org/reports/"}],"requested_url":"https://www.casact.org/reports","source_id":"https://www.casact.org/reports"},"status":"partial","usage":{"bytes_received":30,"requests":1,"runtime_ms":70,"tool_attempts":1}}
